{
  "schema_version": 1,
  "stage": "T0",
  "languages": [
    "python",
    "typescript",
    "go",
    "rust"
  ],
  "baseline_policy": "current released plugins frozen on 2026-10-15; older releases excluded",
  "baselines": {
    "python": {
      "package": "livekit-plugins-rime",
      "version": "1.8.8",
      "requires_python": ">=3.10.0",
      "dependencies": [
        "livekit-agents[codecs]>=1.8.8",
        "protobuf>=6.33.5",
        "rime-api>=0.0.1"
      ],
      "artifact_url": "https://files.pythonhosted.org/packages/21/1d/32dafd2a08bbea9676e60e8a4b48107662a75df2a8bfe2bee15ddc2f97b6/livekit_plugins_rime-1.8.8-py3-none-any.whl",
      "sha256": "20ba19ab20d03424d474d2ddeb14e22bfa4897c098afa71cb3ce0156e8961acc",
      "framework": {
        "package": "livekit-agents",
        "qualification_baseline": "1.8.8",
        "declared_range": ">=1.8.8",
        "requires_python": ">=3.10,<3.15"
      },
      "source_revision": "31c6026df14eebb71975c16ca6a422ce68644b71"
    },
    "typescript": {
      "package": "@livekit/agents-plugin-rime",
      "version": "1.9.3",
      "dependencies": {
        "ws": "^8.21.0",
        "@livekit/av": "^10.0.0",
        "@rimelabs/api": "0.0.1",
        "@bufbuild/protobuf": "^2.14.1"
      },
      "peer_dependencies": {
        "@livekit/agents": "1.9.3",
        "@livekit/rtc-node": "^1.1.0"
      },
      "artifact_url": "https://registry.npmjs.org/@livekit/agents-plugin-rime/-/agents-plugin-rime-1.9.3.tgz",
      "integrity": "sha512-vyQ+3x637U43wdEKCYZ7/lTHPAIPA0UqjGn2MtEIkEKQK23w5Q2n1HEWkzKm8jPGPz0O0vDxaoQX0XZvzmVK/A==",
      "framework": {
        "package": "@livekit/agents",
        "qualification_baseline": "1.9.3",
        "declared_range": "1.9.3"
      },
      "runtime": {
        "documented_node_major_floor": 20,
        "package_engines": null,
        "qualified_patch_floor": null
      },
      "loaders": [
        "import",
        "require"
      ],
      "source_revision": "1871ba2c4eb8fa69e8d04ee60365eab468d051e1"
    },
    "sdk": {
      "source_revision": "b5c1fe4a02e15df6cbd66c26ee0eb0626e20465d",
      "purpose": "existing behavior and proposed provider-owned contract in all four languages"
    }
  },
  "sources": {
    "python.tts.py": {
      "url": "https://github.com/livekit/agents/blob/31c6026df14eebb71975c16ca6a422ce68644b71/livekit-plugins/livekit-plugins-rime/livekit/plugins/rime/tts.py",
      "sha256": "043a3e7af8de181d38c0f1934665e614bd1ce29b576546392e067a9852afaa38",
      "verification": "published artifact bytes match pinned source"
    },
    "python._websocket_v1.py": {
      "url": "https://github.com/livekit/agents/blob/31c6026df14eebb71975c16ca6a422ce68644b71/livekit-plugins/livekit-plugins-rime/livekit/plugins/rime/_websocket_v1.py",
      "sha256": "204ab7a4d02df3a9a121be9ebd67f9574aad1993498b1020f1ec49cb1e0122f2",
      "verification": "published artifact bytes match pinned source"
    },
    "python._websocket_v1_adapter.py": {
      "url": "https://github.com/livekit/agents/blob/31c6026df14eebb71975c16ca6a422ce68644b71/livekit-plugins/livekit-plugins-rime/livekit/plugins/rime/_websocket_v1_adapter.py",
      "sha256": "ac2346e2418f398b70e43f9a33a472a6b042e651f9684a0938c712ac052d1f5f",
      "verification": "published artifact bytes match pinned source"
    },
    "python._legacy_websocket_adapter.py": {
      "url": "https://github.com/livekit/agents/blob/31c6026df14eebb71975c16ca6a422ce68644b71/livekit-plugins/livekit-plugins-rime/livekit/plugins/rime/_legacy_websocket_adapter.py",
      "sha256": "bfaf80c19bfdd8b027afd5b58d385fcc7960b5669816596e6e43f67d9b0a6baa",
      "verification": "published artifact bytes match pinned source"
    },
    "python.models.py": {
      "url": "https://github.com/livekit/agents/blob/31c6026df14eebb71975c16ca6a422ce68644b71/livekit-plugins/livekit-plugins-rime/livekit/plugins/rime/models.py",
      "sha256": "0d17f1f0b637160b33747086e77cf58b4a9d408a03bc80b048a8d9bdef25f8c5",
      "verification": "published artifact bytes match pinned source"
    },
    "typescript.tts.ts": {
      "url": "https://github.com/livekit/agents-js/blob/1871ba2c4eb8fa69e8d04ee60365eab468d051e1/plugins/rime/src/tts.ts",
      "sha256": "ae2178dfb7e8874d934864d5c1f976abda6643f2f96923dc0c8a467dcd09f077",
      "verification": "published artifact bytes match pinned source"
    },
    "typescript.options.ts": {
      "url": "https://github.com/livekit/agents-js/blob/1871ba2c4eb8fa69e8d04ee60365eab468d051e1/plugins/rime/src/options.ts",
      "sha256": "2837f2fb8b11e92175cb0efac6c782b9047802fe9888a49ec0efeab1bdd75ffd",
      "verification": "published artifact bytes match pinned source"
    },
    "typescript.stream.ts": {
      "url": "https://github.com/livekit/agents-js/blob/1871ba2c4eb8fa69e8d04ee60365eab468d051e1/plugins/rime/src/stream.ts",
      "sha256": "e2e9abacf783170b65e8be4804dc5c32ad0e27ed43cc8ad8a1e92480ef60f695",
      "verification": "published artifact bytes match pinned source"
    },
    "typescript.connection.ts": {
      "url": "https://github.com/livekit/agents-js/blob/1871ba2c4eb8fa69e8d04ee60365eab468d051e1/plugins/rime/src/connection.ts",
      "sha256": "bd6e3f2c09bde5bff5fa4f49dec250a74f85a16a458e35bd6deb6349e29bf86e",
      "verification": "published artifact bytes match pinned source"
    },
    "typescript.audio.ts": {
      "url": "https://github.com/livekit/agents-js/blob/1871ba2c4eb8fa69e8d04ee60365eab468d051e1/plugins/rime/src/audio.ts",
      "sha256": "9b4fe7c1aa373c0f8ad346041740c0523b44c1acf6ecb5b34e792e39d77ab25d",
      "verification": "published artifact bytes match pinned source"
    },
    "shared.plan": {
      "url": "../../docs/livekit-tts-sdk-plan.md",
      "verification": "proposed SDK behavior; not implemented"
    },
    "sdk.contract": {
      "url": "../contract.json",
      "verification": "existing gRPC conformance baseline"
    },
    "livekit.runtime": {
      "url": "https://docs.livekit.io/agents/start/voice-ai/",
      "verification": "documentation read 2026-10-15; dependency resolution still requires qualification"
    },
    "engine.proto": {
      "url": "https://github.com/rimelabs/rime/blob/4645997bca5da24f2710b5dfcf4bf90010b7767b/interfaces/rime/text_to_speech.proto",
      "verification": "local pinned source; deployment not established"
    }
  },
  "families": {
    "C01": "Options",
    "C02": "Runtime compatibility",
    "C03": "Transport",
    "C04": "Endpoints and sessions",
    "C05": "Models",
    "C06": "Mist controls",
    "C07": "Legacy Coda controls",
    "C08": "Provider extensions",
    "C09": "Speed",
    "C10": "Output",
    "C11": "Text policy",
    "C12": "Timings",
    "C13": "Preparation and timeouts",
    "C14": "Errors and ownership"
  },
  "gates": {
    "Q1": {
      "status": "resolved",
      "owner_stage": "T0",
      "question": "Use current published Rime plugins and their declared framework/runtime floors; earlier plugin releases excluded by user decision on 2026-10-15."
    },
    "Q2": {
      "status": "open",
      "owner_stage": "transports",
      "question": "Qualify direct Mist v2 HTTP/WS3 and required custom endpoints/models."
    },
    "Q3": {
      "status": "open",
      "owner_stage": "audio",
      "question": "Qualify actual codec/rate pairs and requested versus encoded rate."
    },
    "Q4": {
      "status": "open",
      "owner_stage": "timings",
      "question": "Resolve native scaling wording, WS3 origin/units and malformed metadata policy."
    },
    "Q5": {
      "status": "open",
      "owner_stage": "provider controls",
      "question": "Legacy forwarding is recorded; deployed interpretation/effect of those fields remains unqualified."
    },
    "Q6": {
      "status": "open",
      "owner_stage": "runtime and resources",
      "question": "Qualify dependency patch floors, proxy/TLS/session and redirect behavior, including Node 20 and both module loaders."
    },
    "Q7": {
      "status": "open",
      "owner_stage": "qualification",
      "question": "Set numeric latency, drain, memory and cancellation regression budgets from measured baselines."
    },
    "Q8": {
      "status": "open",
      "owner_stage": "release and adapters",
      "question": "Select finite tested SDK ranges with fixed migrated plugin and Agents artifacts."
    }
  },
  "inventory": [
    {
      "id": "python.constructor.base_url",
      "baseline": "python",
      "entrypoint": "constructor",
      "argument": "base_url",
      "declared_default": "NOT_GIVEN",
      "source": "python.tts.py"
    },
    {
      "id": "python.constructor.websocket_url",
      "baseline": "python",
      "entrypoint": "constructor",
      "argument": "websocket_url",
      "declared_default": "NOT_GIVEN",
      "source": "python.tts.py"
    },
    {
      "id": "python.constructor.websocket_protocol",
      "baseline": "python",
      "entrypoint": "constructor",
      "argument": "websocket_protocol",
      "declared_default": "'binary'",
      "source": "python.tts.py"
    },
    {
      "id": "python.constructor.model",
      "baseline": "python",
      "entrypoint": "constructor",
      "argument": "model",
      "declared_default": "NOT_GIVEN",
      "source": "python.tts.py"
    },
    {
      "id": "python.constructor.speaker",
      "baseline": "python",
      "entrypoint": "constructor",
      "argument": "speaker",
      "declared_default": "NOT_GIVEN",
      "source": "python.tts.py"
    },
    {
      "id": "python.constructor.lang",
      "baseline": "python",
      "entrypoint": "constructor",
      "argument": "lang",
      "declared_default": "'eng'",
      "source": "python.tts.py"
    },
    {
      "id": "python.constructor.audio_format",
      "baseline": "python",
      "entrypoint": "constructor",
      "argument": "audio_format",
      "declared_default": "NOT_GIVEN",
      "source": "python.tts.py"
    },
    {
      "id": "python.constructor.repetition_penalty",
      "baseline": "python",